"Story","Highlights"
"usually make baby food easy steam fruits veggies puree sometimes enough time cook buy earth best baby foods baby likes fruits veggies far like one refused eat tried understood would eat either tastes nasty poor baby immediately made homemade potato zucchini asparagus puree loved would recommend flavor","baby did not like it"
"six month old baby loves earth best 2nd sweet potato chicken dinner favorite seems love earth best 2nd foods fruits vegetables dinners consistency food makes easy eat thick thin","my baby s favorite dinner"
"daughter favorite baby food far ones eat rarely eat kinds however taste bland adult least put unfinished portion fridge may become sort watery point throw unique others combination vegetables especially zucchini <br >i update review today saw little pieces thin stretchy plastic two jars baby food plastic baby food notified earth best sending pieces plastic testing giving baby food even though likes us","baby loves it  but there is plastic in it"
"earths best eats one little thicker original chicken sweet potato favorite runny","baby likes this one"
"would continue buy moving home made finger foods away glass jars shattered many like flavors though great textures","organic and tasty"
"eat baby liked said savory sweet reminded fine dining tuscany also like jarred foods know recycle never become waste learned telling everyone glass recycles forever recycle nothing common stop reading even hard thing anymore nobody else building recycles drives crazy rinse put different bin still put trash day stop lazy","my baby liked it"
"wanted post found small bits plastic food feeding 9 month old plastic food baby food please careful buy considering <br ><br >my daughter loves food actually favorite first time noticed plastic 2 months","moms  and dads  beware of plastic in the food"
"pretty good product taste best definitely worse either gives pretty smooth energetic kick","allday energy"
"true seattle coffee addict never better coffee candy","the best "
"sent basket father birthday said fruit fresh sweet happy healthy purchase","tasty fruit"
"fruit gift really perfect gift everything fresh well packed tasty looking people received assured quite tasty tasting tried chocolate covered cherries ad surprised delicious thank needed something pinch came even earlier expected thank dharana san francisco","beautiful fresh and it came easrly v yey  "
"got girlfriend birthday fruit actually tasted fresh yummy love dark chocolate loved dark chocolate almonds next time give organic version product someone close share","fresh fruit  dark chocolate"
"child facorite memory drinking sassafras tea made fresh sassafras granddad never seen tea bag found get taste remember needed 2 bags per cup bags rather fragile really great product buy plus shipping time great","sassafras tea bags"
"grew ohio lived woods sassafrass trees plentiful would dig tender roots bark trees delightful tea purchased breezy morning sassafrass tea although quite good expensive 20 average size tea bags shipping much product good bargain switched pappy extract","sassafrass tea"
"ordered line received days 3 tea excellent price right","good tasten tea "
"purchased tea neighbor present looking sassafras tea long time realize hard find absolutely loves made great surprise christmas gift","hard to find tea"
"heard great things sassafras wanted try worried taste turned lot better anticipated actually gonna order 4 pack continue drinking time trust fda","better taste than i expected"
"bought dad 2 years would complain tea since 9 finally many nights drinking tea annoyed bought tea would shut","lovely "
"first tasted sassafras tea local restaurant really liked started looking grocery stores online teabag form several weeks investigation called restaurant asked used make tea told pappy sassafras concentrate looked online found amazon com ordering also saw sassafras teabags thought would order box try dissapointed taste like flat rootbeer expecting like black licorice hate mild rootbeer undertone also distinctive red color get steeping sassafras root <br ><br >i never real sassafras tea made root know teabags like real thing bottom line buy teabags","k"
"great tasting tea looking good sassafras tea forever finally ordering product <br >thanks kim","great product "
"care product thought tea sisters use drink elementary school found tea use drink actually came root particular type tree","sass tea"
"purchased read natural cure hives um nothing hives tastes awful luckily co worker mine loves stuff reminds grandmother gave yucky yucky stuff","the most awful taste"
"good sunflower seeds good price prefer unsalted variety hard find <br ><br >one thing keep mind though expiration best date example order april batch receive june use date may stretch consume 300 bags seeds start going rancid since roasted oil unsalted seeds may spoil readily salted variety even refrigerated upon receipt <br ><br >amazon seem specify use dates food products sell gamble purchaser assuming amazon ship stuff expired probably ship oldest stock first use date item may would select choice","these are good  but    "
"love panang curry would rather avoid white rice restaurants serve decided try making product get exactly want hot tasty panang curry adding lots fresh veggies tofu brown rice hot add spices great product purchase","great product "
"purchased friend loves cook find paid 3 times 13 95 4 cans highway robbery know purchase one around 1 09 far item brand panang paste excellent beef panang dish friend made using paste good ones thai restaurant would recommend paste price","great paste but way overpriced like 3x more"
"best paste tried easy use saute meat add veggies paste tin coconut milk quick tasty weight watchers tried using light coconut milk instead full fat works panang paste especially add heaping tablespoon crunchy peanut butter yellow green red spicy need full fat coconut milk balance","so easy to use"
"omg would love cookies except chocolate mixed makes taste medicinal degusting even strong enough word horrible horrible mistake expensive mistake advertised peanut butter cookies bought since everyone else peanut butter chocolate cookies wanted plan peanut butter cookies however received found chocolate peanut butter ones thought okay try omg almost threw taste horrible horrible disgutingly medicinal taste buy zero stars would rate zero instead 1 star","omg do not buy   "
"gravy mix excellent except use water called use milk instead makes 100 better","wonderful gravy "
"south live sofla sometimes get southern influence gravy mix reviewing pioneer country gravy de licious tried others publix brand mc cormick ect best far chose mix 1 2 water 1 2 milk 2 cooked chopped sausage links phenomenal bisquick cheese garlic bisquits like red lobster served small side watercress scrambled eggs super easy make thick finger lickin mmmmmmm heard put potatoes veggies chicken make soups add seasoning pioneer brand name says homestyle american classic","yeeeee hawww "
"nothing easier nothing better even beats grandmother white gravy recipe already peppered nothing mix water takes minute two highly recommend gravy mix disappoint","best white gravy  "
"used pioneer gravy number years easy make tastes great also goes well mashed potatoes meats etc try","pioneer gravy is great "
"great able get sugar way good eat going use sugar least processed unhealthy state top sugar body helping fair trade farmers good thing around happy get amazon","eco sugar"
"coffee fanatic always stayed away never liked instant coffee assumption would similar really enjoy starbucks via instant coffee drink much rather expensive thought would give try wife pleasantly surprised taste think equals fresh brewed acceptable bought first 38 pack local grocery store 7 seemed little high figured would check online find best price started calculating online prices charging 7 bucks 19 count would suggest check local grocery stores might able find cheaper math 7 38 184 per single online price 27 114 236 shipping calculated looking supposed discount coffee supplier get case 12 boxes 69 sales tax free shipping sounds like great deal 12 x 19 228 singles 69 228 302 per single expensive","more expensive online"
"think coffee bags good fresh ground fresh brewed coffee taste far better instant coffee work water cooler hot water dispenser brewed hot water like tea bag making tea tastes far better instant coffee highly recommend coffee lover access hot water access coffee maker individual wrapped sealed bags allow take one tiny tea like bag pocket purse early morning meetings","very convenient and far better than instant coffee"
"keep regular bags decaf bags home times <br >never drink old coffee best way make iced coffee","no pot fresh coffee"
"live dorms without kitchen making cup coffee really easy especially need stay late study wake 2 hours sleep like making tea tastes decent enough starbucks good enough sugar cream","simple  convenient"
"primary point review note packaging less expensive size offered folger get coffee less money <br ><br > recently started drinking coffee lapse many years since know many cups day would use wanted avoid fuss coffeemaker particularly like instant coffee delighted find folger bags <br ><br > brew nice tasting cup coffee kind coffee expert know special terms might used know let bag seep bit minute sure tastes good thanks much better half also learned bags produce least two good cups coffee <br ><br > convenient easy tasty intend take travel alternative room coffee makers yeck vending machines <br ><br >jerry","brews an excellent cup of coffee quickly and easily"
"cannot kind coffee maker work forced buy house coffee shop starbuck across street economy one wants pay high prices started coffee club 20 us buy coffee bags separate creamer enjoy fresh hot tasty coffee every day without paying coffee shop prices thanks folgers","very convenient"
"great work pop instant bag minute make coffee best tasting coffee easy make without mess","great taste"
"fast easy definitely delicious makes great cup coffee easy make good purchase continue order <br >thanx","delish    "
"gave tea try add variety tea habit glad somewhat sweet almost minty taste wonderful aroma nice reddish color tea probably taste factor wonderful japanese green matcha tea look forward experiencing purported health benefits rooibos read","new to rooibos tea"
"tried normal red tea waited review flavor still rings head earthier rooibos tea less frity color muddy water grittiness viscosity well well worth every penny","tasted better than loose leaf rooibos"
"previously tried matcha products generally satisfied quality price decided give pure matcha green rooibos try price seemed competitive quality pure matcha products surpasses others tried stays fresh consistent texture tastes great quality price better others purchased quantity highly recommend pure matcha continue purchase","best matcha quality and price"
"best marinade buy far concerned course everyone tastes think anyone like give five stars","the best"
"great product looking msg gluten free product also lower sodium marinade soy sauce compromise taste either use soy sauce substitute found superior taste looks acts like good marinade celiac gluten intolerant even watching salt intake product way steak marinade","moore s marinade  gluten  low sodium and msg free "
"poland spring driver gave us new tea try and<br >our family really enjoyed looked ingredients quite pleased<br >with natural ingredients calories","great tasting diet tea with all natural ingredients"
"hot sauce one favorites perfect balance tasty spicy smell flavors immediately open bottle mix garlic habanero spices put everything tend go one bottle week highly recommend anyone likes hot sauce","awesome sauce"
"never much hot sauce fan tasted black market hot sauce listning radio one morning creater owner giving interview sounded interesting j sampling sauce raving picked bottle local grocery good keep bottle kitchen extra bottle hand gifts taking potlucks barbecues party happy see buy online amazon","love this hot sauce"
"favorite hot sauce liketo use give anything extra flavor loved going favorite resturants town seeing offering great product really enjoy putting breakfast burritos","great hot sauce "
"local diner eat regularly use kinds foods love hot without flavor like sauces burn taste burn awesome flavor surprised find amazon stumbled across would highly recommend anyone likes good hot sauce","love this stuff"
"browsing around amazon looking gifts pleased see favorite sauce order shipped friends habanero favorite love heat tangy spiciness also love pineapple go wrong ordering","best sauce around"
"favorite hot sauce buy locally love flavor hopefully flavors show amazon people enjoy favorites medium pineapple flavored ones far thank making flavorful hot sauce","tasty hot sauce "
"far habanero medium sauces amazing fiance use nearly daily picked 3 goes really well sorts dishes add extra kick <br ><br >the sauce lasts lot longer appears thick bottle last us couple weeks heavy use love use breakfast eggs burritos dinners soups added spice","best all around hot sauce"
"absolutely love habenaro sauce use eggs sandwiches anything good kick watched progessing popularity theis homegrown product nothing highes accolades chef product get try","best hot sauce around"
"black market hot sauce wonderful husband loves habenero sauce flavorful nice kick fact love medium sauce taste yummy bit zing behind used everything use meal <br ><br >i like fact many different levels spicyness love medium habenero kind like package thank hard work guys keep hard work","hot   flavorful"
"man say salsa bomb different kinds almost every meal owner cool dude dropped free bottles mailbox stole first bottle friends fridge tasted hooked since dont sleep hot sauce","great hot sauce and people who run it "
"sauce good anything like adding asian food anything egg noodles good burn strong flavor im hoping see flavors like pineapple experiment soon buy wont regret","this sauce is the shiznit"
"hot like low star reviewer got suckered seeing habenero name 12 oz size people might like flavor citrus fish sauce mix according ingredient label looking hot","not hot"
"admit sucker large quantity 12 oz shopping hot sauces seeing size bottle reminds wing sauce bottle sizes plastic bottle convenient squirt top overall hot tasty made mostly jalape ntilde os seen ingredients list would bought <br >jalapenos<br >water<br >vinegar<br >brown sugar<br >lime juice<br >fish sauce<br >cilantro<br >habanero<br >garlic<br >spice blend<br >salt<br >potassium sorbate<br >xanthan gum","not hot  not habanero"
"never life tasted good babka crazy good real babka gram mother use make","best babka"
"convinced human animal crackers look taste exactly like human ones yes tasted contain sugar one last ingredients nutrition facts either ill give dog small amounts","my dog loves these but    "
"whole box peanut butter dog cookies wont touch loves begs good buy little chihuhua big mouth 20 per box","she loves them   "
"little animal crackers taste good doggies like buying like human animal crackers flour sugar bad stuff dogs continue buy healthy treats doggies also love without sugar might want try wellness blue buffalo natural balance zukes name","not healthy but they taste good"
"chihuahua loves lil snacks sees bring yellow bus literally runs circles","my dog loves these    "
"purchased little treats stocking stuffers little furry friends yorkies loved treats finally buy since liked much","the puppy dogs love them "
"like animal crackers eat price great little guy loves","a great price "
"smell first like bed fresh roses even though rose content minimal found smell overwhelming like brand spices seal place loosely screwed lid shaker lid either open dumps questioning minute pieces roses could produce perfume odor hope chemically enhanced lid loose sealed doubts safety product","smells like roses but no safety or freshness seal "
"hoping true caramels caramel flavored truffles still delicious would definitely order maybe extra gifts salt makes extra amazing <br ><br >bummer shipping shipping item reasonable bought chocolate covered pretzels time shipping charged items even though arrived box even anything fancy packaging <br ><br >edit okay actually bother stomach little one truffle package shipped ingredients list go company site directly find well hidden hard follow ingredients page discover lot shady ingredients including high fructose corn syrup 40 box expect corn syrup also expect propylene glycol antifreeze vanilla expect 100 vanilla beans artificial vanillin sometimes comes anal glands beavers disappointed ingredient quality <br ><br >","delicious truffle goodness "
"ive craving deer jerky gave one others amazon try one sinue little sweet taste going buy im still search salty dry version im","a little too sweet"
"tried found salty <br >plus ate fish sauce fish realized kind redundant <br ><br >i kidding course stuff great","way too salty"
"usually drink tea love one thought shipping price little high love tea much get perfect little bit honey","warm and wonderful"
"noodles box broken sauce salted good flavor threw skillet would recommend purchasing product","not good"
"cavenders makes best vinegar oil dressing ever couple tbls cavenders 1 4 vinager 1 4 h2o rest oil good","best stuff ever"
"balanced tasty filling good could ask breakfast cereal <br ><br >i still miss kellogg sister product right somewhat lighter blend loved discontinued mueslix strong second best","an ideal breakfast"
"know cannot find supermarket get pack 5 order afraid 5 boxes would last long instead found need order another 5 pack","love  love  love my mueslix  "
"trip italy muesli hotels breakfast cold cereal loved imagine excited saw kellog sold product learn despite similar name cereal quite unlike european style muesli overall mix grains fruits similar cereal mostly flake cereal true muesli cereal flakes <br ><br > real muesli made rolled flaked grains pluses minuses plus side milk turn european mueslis mush couple minutes like flake cereals minus side european mueslis soaked milk yogurt ten minutes e shower coffee brewing cereal bit chewy side concerned eating processed foods rolled grains processed less flaked ones rolled grains lightly steamed rolled lightly toasted flaked grains fully steam cooked mush pressed flakes fully baked usually sprayed sugar extend time mushiness certainly kellog product contains hfcs <br ><br >you owe try one many mueslis amazon better yet single boxes local health foods store one see prefer eat bob red mill product available amazon one local grocery chains instead much satisfied tried familia crazy idea fruit flakes dorset products fruit nut heavy products hair expensive kellog willing plunk extra dime per breakfast far superior product <br ><br >i surprised quaker sell muesli product given largest producer rolled grains u would think would natural fit","nothing like actual muesli"
"recently purchased cereal assuming would contain nothing healthy ingredients read label discovered contains partially hydrogenated soybean oil high fructose corn syrup","contains trans fat and high fructose corn syrup"
"bought product online although kellogg cereal cannot find retail store carries incidentally would like know called kellogg could really give good answer suggested try another product found good appreciate amazon offers continue order way really keeps regular better cereal try like","superior hard to find product"
"cereal difficult find stores appreciate able purchase amazon husband really likes looks forward delivering every month seems like unlikely thing look forward little things count p looney","cereal"
"could find local supermarkets 4 months ago nowhere found every time kellogg makes great cereal quit making soon case right best stuff planet","this is good  but bring back  just right  cereal"
"favorite cereal probably 20 years grocery stores stopped selling started buying web packs 5 boxes use pretty fast","favorite cereal"
"love cereal taste good good pity cannot find cereal local supermarkets brands match","awesome cereal"
"enjoying mueslix since early 90s reason locate mueslix local supermarkets new york order amazon taste perfect sweet care much raisins cereal enjoy greatly enjoyable way supplement fibers whole grain perfect breakfast lasts lunch time tried different kind choices many cereals nothing like mueslix","kellogg s mueslix"
"amazon price may higher grocery stores store good way shop <br >i first tried princess cruise ship found good filling stays important <br >i super please find","overall a "
"almost cannot stop eating cereal eat breakfast evening think want something eat really hungry snack healthy long remembeer healthy eat cup enjoy","wonderful for breakfast and snacks "
"local stores stopped carrying product putting imitation brands shelf great could order cereal within days","great cereal"
"mueslix favorite cereal since came years ago however improved adding raisins nuts point making rich simply add half grain cereal cornflakes also reduces high price stores keep discontinuing mueslix point hard find thank amazon","love mueslix"
"cereal hard find local stores live wife love cereal taste healthfulness whenever find hotel breakfast buffets happy man cannot think eating cereal","best cereal i have ever eaten "
"kellogg mueslix replaced local muesli previously served european b b last trip available locally amazon provided fair price rapid delivery shipping cost prime shipping excellent form muesli","hard to find cereal found "
"eating healthy never tasted good tough find local stores amazon great price especially subscribe save","great taste   healthy cereal"
"kelloggs muselix delicious delivery quick","kelloggs muselix are great"
"cereal best cereal market many flavors including nuts raisins dates especially light malt flavor enjoyed mornings years","mueslix cereal"
"eating kellogg mueslix years love mix fruit almonds whole grain used easy find could find local super markets afraid discontinued found amazon pretty happy","great mix of fruit  nuts  and whole grain"
"sad moment unable find favorite cereal grocery stores sure disappeared grateful able purchace online thanks","not in grocery stores"
"hard find us husband frm jamaica loves says makes fill full day get every mo","yummy for ur tummy"
"mom new york assisted living facility love ceral buying kellogg mueslix lived florida went buy ny luck called kellogg directed amazon com please sold ceral shipped free also save money box also pay shipping two happy people mom gets favorite ceral shipped directly every months send 5 boxes saving money time shopping shipping package mom","my mom s favorite ceral"
"struggling find shops nearby <br >much convenient order amazon slightly expensive save gas burden","finally"
"kellogg mueslix cereal ordered one evening couple days later arrived item well packed contents fresh encountered problems<br >and plan use resource","kellogg s mueslix cereal"
"really like mueslix cereal amazon price awful <br > 22 73 5 pack 4 50 box <br >this product retails stores around 4 box publix kroger ingles <br >so amazon price higher retail <br ><br >mueslix almost never sale though unlike kellogg cereals <br >1 2 times per year publix grocery kellogg cereals half price <br > 2 box incredible price stock next several weeks <br ><br >i expected amazon price like 3 box since 5 pack <br >but boy wrong","cereal is great  price is awful "
"secret high fructose corn syrup detrimental health unfortunately also secret replaced forms sugar disturbingly large number manufactured foods even worse high fructose corn syrup made genetically modified corn <br ><br >since late 1980s hfcs replaced regular table sugar honey similar sweeteners practically everything prolonged consumption hfcs topic much debate learning cause long term damage body <br >high fructose corn syrup dangers<br ><br >1 significant risk weight gain obesity<br >2 increased risk developing type 2 diabetes<br >3 hypertension elevated bad cholesterol levels<br >4 long term liver damage<br >5 mercury exposure hfcs<br ><br >kelloggs manufacturers know slowly getting rid sweetner look cover post rain bran advertising contains high fructose corn syrup applaud high fructose corn syrup made genetically modified corn monsanto uses systemic pesticides seeds causing colony collapse disorder bees bee keeper avoiding products hfcs save family bees watch vanishing bees food matters food inc sold amazon excellent movies change health dramatically way think eat","buyer beware this product contains high fructose corn syrup "
"local grocery stores carry cereal order full nuts raisins great stuff cut banana instead adding sugar favorite box cereal","love it"
"got baby back ribs strips jerky smoker wow seasoning really added lot flavor surprising fact knew added much seasoning turn powering would recommend anyone cooking kind meat jerky great ribs outstanding 27 including shipping 12lbs awesome deal","great stuff"
"try every asian salad dressing find <br >this favorite one salads delicate taste <br >my favorite newman low fat sesame ginger <br >the ginger newman gives stronger flavor great<br >as marinade sprinkle rice vege dishes","delicate asian salad dressing   "
"wow soooo good easily become favorite dressing typically make dressings however use one treat <br ><br >it given gift absolutely love perfect balance sweet oily bitter granted needs good shaking since oil based absolutely love sad running eat salads like every day want dressing unique never somebody love","totally a great balance in flavors i expect from an asian dressing "
