"Story","Highlights"
"totally orgasmic chips best spicy chip ever tasted signed subscribe save option case contained 15 fifteen full sized bags chips price per unit equals 1 73 per package even cost plain chips add free shipping fast delivery deal steal run like stole something computer order spicy thai chips p even paid going price 30 00 still ahead curve enjoy","spicy thai chips"
"seriously tasty tasty tasty fresh <br ><br >the problem pack 24 lend wanting make multiple trips cupboard helpings grabbing multiple bags begin pace keep saying <br ><br >you cannot go wrong fan salt vinegar classic flavor <br ><br >2 ounce bags double size kid bags size ones small gas station racks really good size adult <br ><br >it somewhat healthier snack typical bag fried chips 300 calories per bag bad something think <br ><br >bottom line delicious","delicious  what else did you expect "
"despite coming extremely large box found great value bags preserved reasonable expiration date months away would definitely recommend","great value"
"nasty greasy rich blood plus lacked major flavor spicy jalapeno flavor dissapointed chips always hearing great things chips telling yuck yuck yuck give pain chips day maybe better kettle chip brand staying clear chips wish could give zero stars could","i have had better  jalapeno kettle chips "
"like spicy like spicy enjoyed also crunchy kettle cooked chips","spicy but good"
"decent want realllly good salt vinegar chip try boulder salt malt vinegar chips awesome","boulder salt and malt vinegar chips are way better"
"salt free product purchased chips quite greasy","potato chips"
"best potato chips money buy enough salt taste much masks lingering potatoey awesomeness wolfed bag beauties chip perfect thickness teeth get excited every time put one mouth everything chips perfect like made god delivered gabriel know amazon carries even leave house buy may never eat anything else","lightly salted  heavily delicious "
"things darn cheesy like lot flavor love otherwise overdose cheddary goodness","too much flavor"
"first discovered kettle chips sea salt vinegar shopping trader joe daughter mindy could believe tasty best chip ever eaten love first bite munching ever since <br ><br >other things favor thicker chips crumble devouring delightfully crunchy salt vinegar combination heavenly tried create original line describe palate pleasing taste treat could beat manufacturer said tongue puckering tang crunch poetic <br ><br >as health values since kettle chips peeled preparation getting nutrition potassium vitamin c mother would approve fact hand cooked small batches <br ><br >i often enjoy kettle chips afternoon snack favorite soda iced tea also delicious tuna sandwich hot dog lunch well actually kettle chips go perfect everything except sweets course <br ><br >my problem delicious cannot stop eating reason chose smaller packets figured 24 could last almost month good girl kept appetite control hid kids sake fewer calories try hard succeeded far easy <br ><br >have told much love <br ><br >reviewed betty dravis 2008<br >millennium babe prophecy","love at first bite  tongue puckering tang and crunch "
"need salt hide taste potato chips chips prove taste potato comes instead masked ok still snack food salt trans fats mean healthiest potato chips get low salt diet like available means eat chips kettle best","the best chips   period "
"potato chips excellent trans fats <br ><br >they taste absolutely delicious whenever mood potatoe chips kettles brand buy <br ><br >a great product anyone enjoy highly recommend <br ><br >enjoy","delicious extra crunchy"
"feels strange review chips compelled absolute favorite chips kettle lots flavors always go back regular lightly salted <br ><br >they thicker sometimes greasy bottom bag plus often looked burned actually burned something much sugar potato makes dark love open bag find browned chips <br ><br >lays wise place become chip snob thanks kettle <br ><br >like edy breyer ice cream products worth money best best","chip snob alert "
"tried lot v chips best real sea salt real vinegar mouth watering flavor crispiness faint heart flavor authentic","best salt   vinegar "
"kettle brand chips crunchy would say regular plain old lays potato chips soft end soft crunchy spectrum ruffles brand potato chips used considered crunchiest kettle brand chips far crunchy tender mouth bad teeth dentures might want steer clear kettle brand otherwise love chips sea salt vinegar chips super tangy enjoy taking swigs vinegar bottles time time dissapointed salt vinegar chips either chips soft vinegar taste whimpy chemically rest assured kettle sea salt vinegar gourmet flavor vinegar flavor chemical flavor could never called whimpy","gourmet powerful salt   vinegar chips "
"loved chips chips would buy discovered england back 2000 quickly became fan year ago picked bag sale local supermarket finding odd sale much took advantage opening bag found chips even close kettle chips used uniform whitish yellow color flavor way lovely extra crisp brown chips gone completely disappointed e mailed kettle following happened bought bag chips day different taste tastes cheaper know else put also noticed chips seemed less cooked see browner colored chips flavor hoping nothing changed ingredients process used produce product get weird batch buying kettle chips 10 years wondering receive reply thanks letting us know experience kettle brand® chips sounds like may received bag slipped inspections apologize potatoes vary seasonally could account variation color chips still taste great thanks providing us best code bag really helps passing comments staff <br >we sending coupons replace purchase kettle brand® flavors nut butters believing great experience next purchase case buy product suggest avoiding best date still rare instance another bag case slipped inspections time <br >thanks letting us know expect coupons arrive within 3 weeks please let know help well next bag good since time picked 3 bags chips like bad bag pretty sure changed product reduce cost research found kettle bought private equity company cookie cutter management processes probably employed kettle acquire company high quality brand recognition sell product mass merchants lower quality cost product increase margin finally sell company customer base starts realize brand longer quality brand increased profits make company valuable paper make nice profit investors customer employees lose course unsuspecting buyer exploited brand stay away kettle chips longer","they changed the chips now they taste horrible"
"someone brought party last month put buffet full think anyone would like saltless potato chips last week friends pantry put oh gosh good wrong think would bland full real potato flavor wonderfully crisp fresh tasting amazon buy case want dips truly delicious","do not miss the salt "
"backyard bbq kettle chips great deal promo code nice larger size bag kettle chips grocery store 5 ounces polish one family lunch arrived fresh crumbles chips amazon grocery great flavor natural","great deal"
"tried herrs utz wise pringles lays etc kettle tasted best quantity salt used optimum required <br ><br >although say serving size 1 ounce finish whole packet time total calories 300 2 ounce bag slightly higher side still ok compromised taste <br ><br >only issue packets burnt chips taste bad kettle take care packing ensure burnt chips <br ><br >thanks amazon get 24 bags 12 bucks free shipping using coupon","best chips out there   "
"chips tangy hoped expected poore brothers better choice hard core salt n vinegar fans","great price  but not as tangy as i expected "
"bags lot overcooked brown pieces also felt greasy keep wiping fingers napkin","burnt"
"first time tried thought wow quickly found darn spicy tart hard enjoy potato chippiness mouth seige","gaaak  an  extreme  potato chip    "
"got kettle chips sea salt vinegar 15 5oz bags impressed tasted kind flat eating bag looked bag noticed hole bag size sesame seed started looking unopened bags many type hole bags multiple holes one bag hole size dime bottom bag like rodent got box shipped holes packed way much quality control ever let ship fired needless say never eating anymore kettle products expect full refund kettle amazon <br >m martin","kettle chips"
"chilling fridge seems boost flavor even using rather corn chips make nachos tastebuds singing like janet jackson without associated wardrobe risks highly recommended","absotively  posilutely delicious"
"originally produced england best chips ever tasted unfortunately since bought us conglomerate taste plain nasty hard rather crispy much thinner used lacking flavour real shame","gone down hill"
"opening numerous bags found none chips flavoring completely plain gross even happen","completely ripped off"
"getting worried read reviews specifically one star reviews always go see faults reviewers find merchandise would prevent buying <br ><br >wow sure seemed hate kettle chips backyard barbecue 9 ounce bags pack 12 bought 1 ounce bags liked lot decided subscribe good measure got 2 orders 9 ounce bags <br ><br >yes love potato chips especially kettle chips backyard barbecue flavour others seemed really hate least hate changed <br >but realized talking flavours amazon deep wisdom obviously seen fit put comments concerning flavours kettle brands potato chips together <br ><br >of course advantages potato chip lovers like enjoy eating several flavour brand varieties comparisons made easily also potato chip lovers person favourite flavour reviewing sort united nations potato chip lovers different united love potato chips rest world really benefit example tightly knit ever er expanding group think first realizing these<br >different flavour reviews together cause little confusion dismay least begin amazon mentioned kettle potato chip review forum <br ><br >i happy report kettle chips backyard barbeque flavour totally delicious least one ounce bags hopefully product 9 ounce bags taste definitely chips adults however children whose stronger adult taste buds withstand strong flavour chips strongest flavour ever jalapeno pepper chip far strong even <br >these backyard barbeque chips kettle however right amount sweetness honey powder onion sugar take edge stonger flavours<br > paprika chili pepper cayenne pepper natural smoke flavour less come list ingredients sweeteners <br ><br >the complete list ingredients kettle backyard barbecue chips 1 ounce bags hopefully 9 ounce bags well follows <br ><br >potatoes<br >vegetable oil safflower sunflower oil <br >honey powder dried cane sugar honey <br >rice powder<br >sugar<br >salt<br >onion powder<br >tomato powder<br >paprika<br >torula yeast<br >garlic powder<br >chili pepper<br >citric acid<br >cayenne pepper<br >paprika oleoresin colour <br >natural smoke flavour<br ><br >naturally cooked natural ingredients combination true taste treat <br ><br >of course ptato chips moderation key <br >potatoes contain lot potassium gives energy othr good things much damage kindneys vegetable oil great much oil well much starch potatoes hurt eyes natural smoke flavour yummy well sugar large amounts linked cancer production<br ><br >as far starch potatoes oil go this<br >can ameliorated bit drinking tea good eyes far potassium energy good much bad kidneys sugar natural smoke flavour much leading cancer production thing good everything e r n <br ><br >twice three times month allow go call potato chip diet eat one large bag equivalent small ones potato chips day supplement tea coffee lemonade well several servings carnation instant breakfast essentials like dark chocolate flavour adds fewer calories would normally eat normal three meals day plus snacks also teaches eat l w l one big bag many little bags never lasts long would like anyway excercise sensible eating rest month keeping scale nearby weighing least twice day every day taken ten pounds last three months <br ><br >these backyard barbeque flavour potato chips kettle <br >are totally scrumptious except jalapino chips tasted good far spicy taste buds yet meet potato chip like eat kettle backyard barbeque flavour potato chips combination potatoes sweetness spices truly become one top five favourites first favourite <br ><br >flavoured potato perfection","c h i p     c h i p     h o o r a y                b a c k y a r d     b a r b e c u e  "
"chips okay personally find flavor combination greasy chip somewhat strange necessarily bad kind chip going able three four chips flavor loses novelty","not the best"
"bought local supermarket enjoyed although salty leave tongue roof mouth burning keeps eating many occasionally get really stale items amazon com one unedible beware quality food items website special close due dates case expired stale unedible","stale  beware buying these on special "
"chips good could stop eating last long <br ><br >the reason gave 4 stars instead 5 think bags little hard open sure need make potato chip bag sturdy may need scissors hand open much easier","these are very good"
"kettle brand chips used good oily crunchy flavorful suspect company bought recipe changed worse better big name brand chip try good health kettle style olive oil chips instead good kettle brand r p kettle brand chips","used to be my favorite chips"
"absolutely forget confirmed reviewers chips total garbage like chewing styrofoam packaging peanuts positively awful hyperbole exaggeration never buy anything kettle brand ever reportedly great premium brand literally mass market chip ever tried tastes better stale rancid tasting virtually salty taste whatsoever completely awful","stale  rancid oil taste  and if you like even the tiniest bit of salt flavor on your chips   "
"chips nasty thought someone spilled drink bag chips soaked grease nasty","disgusting"
"unless like salt vinegar chips salty eating actual pinches salt drinking actual vinegar doubt like chips saltiest sourest chips ever reason stops throwing away paid 2 full boxes dont like waste food brown chips especially bad besides salty sour also taste overcooked burnt unless rare kind take kind extreme taste like chips <br ><br >i actually high tolerance sour taste bag chips bit difficulty normal people please try home","taste terrible  way too strong"
"bought brand trial since tired pingos <br ><br >it claims natural argument point 50 bag fried brown color really suffer eating fried chips open bags looks like throw away know bad luck every bag selling sure never buy brand","over fried"
"good wish also baked found baked salt potato chips anywhere wish someone would post","no salt kettle chips "
"better england know maybe nostalgia part","not as good as the english sell"
"ordered kettle chips following flavvors<br >salt fresh ground pepper<br >tuscan 3 cheese<br >n cheddar hers<br ><br >they tasted variety pack suggest u order ordering large size <br ><br >i wish could return unopened bags","very disappointed"
"purchased low salt indeed low salt however many many chips bag literally dripping oil never encountered problem potato chip brands unappetizing wants oil never buy would recommend others","dripping in oil"
"looking strong v flavor definitely mild comparison many others live tx tell tried v chips get ahold best best heb storebrand world market bob zapp bad chip standpoint typically great kettle crunch looking v flavor touch","not so good "
"know case chips received everyone allowed sample chips buffet style setting agreed slightly salty side <br >one person jokingly stated would terrific melting ice snow due amount salt <br ><br >we ordered expectations would similar lay kettle mesquite potato chips kettle brands outback bbq chips exact opposite <br ><br >sorry folks better expectations chips little salty side <br ><br >we still looking forward amazon finally getting lay kettle mesquite potato chips stock <br >these got 2 star bbq powder used flavorful enough unique","bags o  salt with chips added "
"chips greasy taste burnt grease bottom bag chips saturated especially bottom bag even trans fat free need lot less greasy","chips"
"waste money kettle brand potato chips bought case case cheddar sour cream cases ended garbage","garbage"
"defintely tasty madhouse munchies family favorite kettle dark burnt broken bits taste greasy oily light crunch oh well","they are not madhouse munchies   "
"love sour food one cannot bear strong sour taste even open bag sour smell strong like","too sour "
"unless really really really like vinegar avoid chips called vinegar sea salt sea salt vinegar","awful taste"
"loved kettle brand sea salt vinegar chips since first time tried fact able find line great price wonderful would definitely make purchase quick simple snack lunch goes great cold sandwich","delicious"
"used eat spicy thai flavor time msg makes body unhappy one flavored chips msg free changed whole recipe make instead real food ingredients like used mostly processed chemical garbage bunch salt msg stuffed label yeast extract removed msg label know well <br ><br >the worst part though taste horrible instead crisp oily full character say cooked like kettle something instead color uniformity baked lays spicy thai flavor tastes like sour cream onion ranch gone rancid <br ><br >what shame kettle chips seems slowly moving one flavor time new cheap ingredient list manufacturing method dont fooled paying premium price chips premium product anymore","kettle has sold out  the chips are horrible now"
"chips great first bags however first bag two noticed remaining bags damaged holes bag black sticky stains outside reviewers bought around time claiming found rodent holes bags chips <br ><br >the chips came sealed kettle box hard say screwed someone somewhere screwed chips health hazard holes bag like game roulette","the bags were damaged with holes and stains "
"waiting ridiculous amount time case 15 5oz bags arrive upon opening box noticed every bag chewed open mouse know still box outside porch son gets home going pictures taken email amazon outside amazon box intact either kettle chips people amazon warehouse know never buy amazon cannot tell disgusted purchase makes sick think <br ><br >i included pictures top page poor little mousie must high cholesterol <br ><br >update forgot mention offered email pictures mouse damage amazon told want","kettle chips make great mouse food"
"kettle chips best potato chip god ever invented give lord thanks every day delivering unto incredulously delicious blend ginger spice veritable cornucopia flavor actually changed diet strict regiment spicy thai sea salt vinegar flavors alternating days already lost 5 lbs mention myriad health benefits experiencing get life back kettle chips","orgasmic"
"daughter autism craves hot spice pungent foods absolute favorite chips calls sour chips wants lunch time love crispy kettle way cooked","a tang that packs a punch "
"great fan potato chips thai food happy kettle chips decided meld two great loves together concept chips spicy enough without burning hole tongue also nice hint sweetness makes habit forming careful treat definitely worth indulging","great  hot  new flavor    "
"terrible cannot believe received item every single bag opened 4 stationed afghanistan gonna snack team going missions embarrassed bags opened spilt box gross box filled grease stains idk airplane ride way box insulated bubble wrap used instead paper unhappy stale crusty chips bag us soldiers cannot enjoy","horrible i cant believe this "
"reading reviews got nervous opened bag recent order expecting worst worries bags great shape expiration dates june chips least first bag taste like supposed good world way fifteen bags thirty dollars ton less expensive going price around local grocery store yay team","favorite kettle flavor and a great value "
"kettle branch potato chips new york cheddar good like kettle fried potato chips waaaay salty burnt side taste rancid either cheese flavoring oil fried already old want like brand chips try new flavors every tried sorts brands kettle cooked chips hit spot","kettle brand potato chips   new york cheddar"
"glad able find site love flavor crunchy box packed inside another box still bags end crumbs bags survived tact","my favorite flavor"
"chips taste awesome unlike flavored chips actually make sure plenty flavory salty goodness gets individual chip pass gas near pretty ladies consumption totally know","so much flavor your farts will smell like sweet onions"
"kettle chips really careful flavors nauseating said make fantastic plain chips thick cuts potato fried dark golden brown crunchy lightly salted sea salt cannot recommend chips enough regret <br ><br >some people say burnt website take quick look see immediate difference kettle brand® potato chips beautiful tawny gold cooking natural sugars select potatoes caramelize creating chips light gold deep amber results flavors deep rich colors artisanal display every bag <br ><br >some also said chips oily true explain website kettle foods exclusively use expeller pressed high monounsaturated sunflower safflower oil make kettle brand® products oils naturally free trans fatty acids hydrogenated way taken extra step sending products independent third party labs test presence trans fats results indicate trans fat free meaning none detected see zero trans fats listed packaging oiliness natural happens quality oil used <br ><br >you find chips natural potato flavor also fan unsalted potato chips us watching salt intake unsalted chips best get period","great chip "
"among best chips ever eaten first came upon visited costplus world market store opelika al tiger town mall 2007 big fan dijon flavored anything decided give chips try hooked probably ended buying dozen bags within months time searched part alabama northwestern part state could find later tried find world market hoover patton creek shopping center carry flavor however learned available amazon com also available prime shipping bought soon read kettle chips honey dijon 9 ounce bags pack 12 <br ><br >you get pretty big box filled 12 bags delicious morsels last quite order soon suggest buy bulk form enjoy disappointed go great hamburgers hot dogs perfect spring coming summer outdoor activities cook outs <br ><br >take word chips hidden gem lost world snack foods buy today fall love like","awesome and delicious "
"never addicted anything life tasted chips tried brands sea salt vinegar flavor got stick blue bag chips","the only thing i have ever been addicted too   these chips "
"addicted salty tangy flavors opened first bag sea salt vinegar kettle brand chips knew perfect complement vegetable trays cucumber carrot celery cherry tomatoes skip dip balance tangy chips alternating bites raw vegetable <br ><br >as oregonian proud share delectable snacks friends especially living outside state experienced gourmet chips tell kettle brand potato chips microbrews beer <br ><br >kettle brand potato chips unmistakable light gold color rich flavor amazing crunch kettle brand chips also healthier snacking option major chip brands kettle brand chips trans fats msg artificial flavors colorings company also line organic potato chips products certified kosher <br ><br >i also recommend","one bite and you will become a  chippoisseur "
"bought sale amazon nice crispy thick chips definitely great buy catch sale","good chips"
"like order kettle spicy thai chips amazon hard find locally probably aggrieved know recipe changed like regular potatoe chips paid husband gets eat like spicy thai fine <br ><br >yuck","what happened  the recipe has changed"
"found new taste treat big one potato chips sure come late discover think really good processing ingredients list actually pretty good trans fats etc want indulgence thicker tasty mass produced potato chips come know much flavorful never honey dijon potato chip incredibly good flavorful combination sweet tangy salty also overly hot spicy excellent <br ><br >if want snack something really good got worth calories","yum  if you want a snack  have something really good "
"real good product love chips customers cannot go wrong wit best","a good buy"
"love chips whole family hooked chips eat","yoli"
"know say others covered like potato chips like get em sale limit intake","good chips"
"looking probably already know like chips <br >this great deal problems going stale <br >the 1oz bags great size snack help avoid eating","awesome"
"admit oversalted chip addictive really think one gone far skin literally peeled lips inside mouth eating surprised still market","burns the skin off your lips"
"5mg sodium per serving chips crisp sometimes dip low salt ketchup adds bit flavor","great chips with very low sodium"
"found product kettle chips unsalted fabulous found accident amazon hunting local stores crisp tasty without salt","kettle chips"
"saw spicy thai chips knew try love spicy love thai food first chips super spicy actually taste sort sweet first many degrees flavor spiciness lingering taste bites afterwards would say definitely good unique chip absolutely hate sweet chips would try different flavor since little sweet","spicy thai"
"smiles thank lord found another healthy snack food unsalted tastes great almost gave finding potato chip like thing would ask kettle change texture slightly hard crunchy problem would prefer softer kettle make happen please keep everything else thank","smiles"
"favorite everybody way sort taste like oriental flavor ramen kick one go wrong combination jalapeno ginger bit rich everydayforamonth snacking case purchase recommend trying single bag buying entire case 2oz size seems longer available shame eat entire 5oz bag","my favorite kettle chip"
"salt vinegar chips favorite flavor think tried every brand far best also like sodium content high like others excessively greasy seem right balance salt vinegar taste","best salt   vinegar chips out there "
