"Story","Highlights"
"bought several vitality canned dog food products found good quality product looks like stew processed meat smells better labrador finicky appreciates product better","good quality dog food"
"product arrived labeled jumbo salted peanuts peanuts actually small sized unsalted sure error vendor intended represent product jumbo","not as advertised"
"confection around centuries light pillowy citrus gelatin nuts case filberts cut tiny squares liberally coated powdered sugar tiny mouthful heaven chewy flavorful highly recommend yummy treat familiar story c lewis lion witch wardrobe treat seduces edmund selling brother sisters witch"," delight  says it all"
"looking secret ingredient robitussin believe found got addition root beer extract ordered good made cherry soda flavor medicinal","cough medicine"
"great taffy great price wide assortment yummy taffy delivery quick taffy lover deal","great taffy"
"got wild hair taffy ordered five pound bag taffy enjoyable many flavors watermelon root beer melon peppermint grape etc complaint bit much red black licorice flavored pieces particular favorites kids husband lasted two weeks would recommend brand taffy delightful treat","nice taffy"
"saltwater taffy great flavors soft chewy candy individually wrapped well none candies stuck together happen expensive version fralinger would highly recommend candy served beach themed party everyone loved","great  just as good as the expensive brands "
"taffy good soft chewy flavors amazing would definitely recommend buying satisfying","wonderful  tasty taffy"
"right mostly sprouting cats eat grass love rotate around wheatgrass rye","yay barley"
"healthy dog food good digestion also good small puppies dog eats required amount every feeding","healthy dog food"
"know cactus tequila unique combination ingredients flavour hot sauce makes one kind picked bottle trip brought back home us totally blown away realized simply could find anywhere city bummed <br ><br >now magic internet case sauce ecstatic <br ><br >if love hot sauce mean really love hot sauce want sauce tastelessly burns throat grab bottle tequila picante gourmet de inclan realize taste never want use sauce <br ><br >thank personal incredible service","the best hot sauce in the world"
"one boys needed lose weight put food floor chubby guy protein rich product food higher skinny boy jump higher food sits going stale really go food chubby boy losing ounce week","my cats love this  diet  food better than their regular food"
"cats happily eating felidae platinum two years got new bag shape food different tried new food first put bowls bowls sit full kitties touch food noticed similar reviews related formula changes past unfortunately need find new food cats eat","my cats are not fans of the new food"
"good flavor came securely packed fresh delicious love twizzlers","fresh and greasy "
"strawberry twizzlers guilty pleasure yummy six pounds around son","strawberry twizzlers   yummy"
"daughter loves twizzlers shipment six pounds really hit spot exactly would expect six packages strawberry twizzlers","lots of twizzlers  just what you expect "
"love eating good watching tv looking movies sweet like transfer zip lock baggie stay fresh take time eating","poor taste"
"satisfied twizzler purchase shared others enjoyed definitely ordering","love it "
"twizzlers strawberry childhood favorite candy made lancaster pennsylvania candies inc one oldest confectionery firms united states subsidiary hershey company company established 1845 young smylie also make apple licorice twists green color blue raspberry licorice twists like all<br ><br >i keep dry cool place recommended put fridge according guinness book records longest licorice twist ever made measured 1 200 feet 370 weighted 100 pounds 45 kg made candies inc record breaking twist became guinness world record july 19 1998 product kosher thank","great sweet candy "
"candy delivered fast purchased reasonable price home bound unable get store perfect","home delivered twizlers"
"husband twizzlers addict bought many times amazon government employees living overseas cannot get country assigned always fresh tasty packed well arrive timely manner","always fresh"
"bought husband currently overseas loves apparently staff likes also <br >there generous amounts twizzlers 16 ounce bag well worth price","twizzlers"
"remember buying candy kid quality dropped years still superb product disappointed","delicious product "
"love candy weight watchers cut back still craving","twizzlers"
"lived us 7 yrs miss twizzlers go back visit someone visits always stock say yum <br >sell mexico faithful buyer often able buy right","please sell these in mexico  "
"product received advertised <br ><br >","twizzlers   strawberry"
"candy red flavor plan chewy would never buy","nasty no flavor"
"glad amazon carried batteries hard time finding elsewhere unique size need garage door opener <br >great deal price","great bargain for the price"
"got mum diabetic needs watch sugar intake father simply chooses limit unnecessary sugar intake one sweet tooth loved toffees would never guess sugar free great eat pretty much guilt free impressed ordered w dark chocolate take office eat instead snacking sugary sweets <br >these excellent","yummy "
"know cactus tequila unique combination ingredients flavour hot sauce makes one kind picked bottle trip brought back home us totally blown away realized simply could find anywhere city bummed <br ><br >now magic internet case sauce ecstatic <br ><br >if love hot sauce mean really love hot sauce want sauce tastelessly burns throat grab bottle tequila picante gourmet de inclan realize taste never want use sauce <br ><br >thank personal incredible service","the best hot sauce in the world"
"never huge coffee fan however mother purchased little machine talked trying latte macciato coffee shop better one like products usually non coffee drinker <br >the little dolche guesto machine super easy use prepares really good coffee latte cappuccino etc less minute water heated would recommend dolce gusto anyone good price getting one","great machine "
"offer great price great taste thanks amazon selling product <br ><br >staral","this is my taste   "
"mccann instant oatmeal great must oatmeal scrape together two three minutes prepare escaping fact however even best instant oatmeal nowhere near good even store brand oatmeal requiring stovetop preparation still mccann good gets instant oatmeal even better organic natural brands tried varieties mccann variety pack taste good prepared microwave adding boiling water convenient extreme time issue <br ><br >mccann use actual cane sugar instead high fructose corn syrup helped decide buy product real sugar tastes better harmful stuff one thing like though mccann use thickeners oats plus water plus heat make creamy tasty oatmeal without need guar gum convenience product maybe guar gum sitting bowl instant mccann becomes thick gluey","best of the instant oatmeals"
"good instant oatmeal best oatmeal brand uses cane sugar instead high fructouse corn syrup better sweetness doctors say form sugar better great cold morning time make mccann steel cut oats apple cinnamon best maple brown sugar regular good plus require doctoring actually tell three flavors apart","good instant"
"instant oatmeal become soggy minute water hits bowl mccann instant oatmeal holds texture excellent flavor good time mccann regular oat meal excellent may take bit longer prepare time morning best instant brand ever eaten close second non instant variety <br ><br >mccann instant irish oatmeal variety pack regular apples cinnamon maple brown sugar 10 count boxes pack 6","great irish oatmeal for those in a hurry "
"mccann instant irish oatmeal variety pack regular apples cinnamon maple brown sugar 10 count boxes pack 6 <br ><br >i fan mccann steel cut oats thought would give instant variety try found hardy meal sweet great folks like post bariatric surgery need food palatable easily digestible fiber make bloat","satisfying"
"us celiac disease product lifesaver could better getting almost half price grocery health food store love mccann instant oatmeal flavors <br ><br >thanks <br >abby","love gluten free oatmeal   "
"else need know oatmeal instant make half cup low fat milk add raisins nuke 90 seconds expensive kroger store brand oatmeal maybe little tastier better texture something still oatmeal mmm convenient","it is oatmeal"
"visiting friend nate morning coffee came storage room packet mccanns instant irish oatmeal suggested try use stash sometimes nate dose give chance say ended trying apple cinn found tastefull made water powdered milk goes good j coffee slice toast ready take world day least jerry reith","good way to start the day    "
"ordered wife reccomended daughter almost every morning likes flavors happy happy <br >","wife s favorite breakfast"
"variety packs taste great <br ><br >i every morning 0 30 cents per meal understand everyone earth buying stuff <br ><br >maple brown sugar terrific followed apples cinnamon followed regular get tired ole thing taste great <br ><br >i boil water small pot empty packet 2 bowl pour boiling water watch expand 2x size <br ><br >taste really good takes minutes prepare <br ><br >not sure everyone earth convenient healthy quick excellent quality extremely cheap","why would not you buy oatmeal from mcanns  tastes great "
"mccann makes oatmeal every oatmeal connoisseur whether one likes raw pellet state cooks half hour sloth addled instant done microwave three minutes good sure beauty instant variety available different flavors well regular <br > variety pack allows different tastes explored well giving chance experience difference mccann well known oatmeals personally like mccann cooks thicker body top brand america apples cinnamon though tends little liquidy may want experiment amount water add 1300watt microwave oatmeal cooks one minute twenty seven seconds also watch get handle much time water use <br > bad thing consider bad thing offering buy lot end six ten count boxes good whole family oatmeal eaters single person alone well love oatmeal","oatmeal for oatmeal lovers"
"mccann oatmeal every morning ordering amazon able save almost 3 00 per box <br >it great product tastes great healthy","food great"
"mccann oatmeal good quality choice favorite apples cinnamon find none overly sugary good hot breakfast 2 minutes excellent","good hot breakfast"
"really like mccann steel cut oats find cook often <br >this tastes much better grocery store brands convenient <br >anything keeps eating oatmeal regularly good thing","great taste and convenience"
"seems little wholesome supermarket brands somewhat mushy quite much flavor either pass muster kids probably buy","hearty oatmeal"
"good oatmeal like apple cinnamon best though would follow directions package since always comes soupy taste could since like oatmeal really thick add milk top","good"
"flavors good however see differce oaker oats brand mushy","mushy"
"really like maple brown sugar flavor regular fine brown sugar added apples cinnamon flavor ok quick easy satisfying breakfast order brand variety get maple brown sugar","very good but next time i will not order the variety pack"
"stuff buy big box stores nothing healthy carbs sugars save money get something least taste","same stuff"
"oatmeal good mushy soft like quaker oats way go","do not like it"
"got free package bottle bloody mary mix bought seller advertising worked lol tried shared 2 buddies loved im buy noticed reviews yet well hot burn mouth forever hot nice temp perfect us","hot  and good  came back for more   "
"stock last time looked go vermont country store weston find along jaw harp cranberry horseradish sauce fartless black bean salsa apple cider jelly newton cradle art motion staple vermont maple syrup <br ><br >back ass kickin peanuts hot activate perspiration glands behind ears arms requires beverage advertised glass cold milk box kleenex since make nose run look like ordinary peanuts already giving ideas work suspect people hitting goodies absence especially colleague greg going take work earliest opportunity empty contents ordinary planters peanuts see whose crying whose nose running return <br ><br >the shaken ensure spices evenly distributed important wash hands consumption touch eyes <br ><br >you go nuts ass kickin peanuts <br ><br >p sharing peanuts deliberately probably give greg jaw harp christmas insulted","you will go nuts over ass kickin  peanuts "
"used spicy foods south texas spicy doubt much habanero used could take notch two","not ass kickin"
"roast home stove top popcorn popper outside course beans coffee bean direct green mexican altura seem well suited method first second cracks distinct roasted beans medium slightly dark great results every time aroma strong persistent taste smooth velvety yet lively","roasts up a smooth brew"
"roast large cast iron pan grill 1 3 bag time smell wonderful roasted beans taste delicious importantly coffee smooth bitter aftertaste numerous occasions send roasted beans home friends like much","our guests love it "
"deal awesome arrived halloween indicated enough satisfy trick treaters love quality product much less expensive local store candy","awesome deal "
"chocolate say great variety everything family loves family six goes fast perfect variety kit kat reeses take five","how can you go wrong "
"great product nice combination chocolates perfect size bags plenty shipped promptly kids neighborhood liked candies","awsome   kids in neighborhood loved us "
"halloween sent bag daughters class share chocolate fresh enjoyed many","great deal "
"watch prices assortment good get gold box purchase price was<br > 3 4 less target","better price for this at target"
"bag candy online pretty expensive cheaper order compete grocery stores good combination favorite candy","pretty expensive"
"arrived 6 days stale could eat 6 bags","stale product "
"used endurolyte product several years pill powder form long desert rides dirt bike always found camelbak water heavily laced endurolyte powder overly tasty quite effective never got cramp several hundred mile rides desert racing buggy camelbaks always laced powder fizz great product firstly hammer endurolyte product great endurance athlete world use products second convenient handly tablets dissovle fizz third tastes great imagine getting nice cool drink body starving hydration electrolytes rather getting salty taste get refreshing lemon lime mango camelbaks always get fizz also drop tablet bottled water whenever exercise nice flavored water chock full electrolytes cannot recommend product hammer product highly enough","hammer nutrition  s fizz rocks "
"product serves well source electrolytes long run bike ride <br >i tried flavors really like grapefruit flavor taste actually like slight carbonation <br >i use hammer products really like whole product line","great source of electrolytes"
"stuff really works preventing cramping middle latter stages rides pop 1 water bottle set flavor fine goes easy","great for preventing cramps"
"us low carb diet little tablets thing <br ><br >two years ago started cycling many years heart arrhythmia longer rides high heat drinking plain water little research thought electrolytes might issue gatorade option loaded carbohydrates looked around low carb alternative zero carb sports drinks help one day ran across bike shop tried tube voila problem solved <br ><br >i shared two friends particular whose problems leg cramps resolved using <br ><br >these guys got right superbly formulated simply work","low carb alternative to gatorade"
"purchased mango flavor take like mango hint sweetness unfortunately hint aftertaste almost like licorice consuming various sports nutrition products decades familiar come like taste products tried mango flavor one least appealing tasted terrible bad enough notice bad taste every sip take","taste is not so good "
"impulsive like 6 ok get wrong quality babies good complaints retrospect price little ridiculous esp add shipping","how much would you pay for a bag of chocolate pretzels "
"sooooo deliscious bad ate em fast gained 2 pds fault","pretzel haven "
"albanese gummi bears rings good tasty high quality bears even little faces local candy store type gummi stuff bears rings snakes balls worms whatever 10 lb twin packs 4 5 5 pound bags screaming deal far concerned probably 50 pounds deep friggin things consumed","great gummi "
"grape gummy bears hard find area fact pretty much anyone talk grape gummy bears think lying bought 10lbs bears little bit bigger brands kind sour kick nothing strong love grape flavored candy soda pretty good another company makes grape gummy bears little bit better opinion well worth price like use gummy bears home made popsicles flavored sports drink salt sports drink makes softer popsicles gummy bears awesome frozen delicious","bigger then other brands"
"ordered two two raspberry latice tarts directly fantasicakes website dinner party hosting arrived fresh intact good size froze half later use pastry lover best ever tasted pastry soft jam really good taste great gone time guests really impressed","best ever latice tart"
"buyer beware please sweetener everybody maltitol alcohol sugar undigestible body know short time consuming one unsuspecting many cannot digest extreme intestinal bloating cramping massive amounts gas person experience nausea diarrhea headaches also experienced learned lesson hard way years ago fell love sugar free chocolates suzanne sommers used sell thought would found sugar free chocolate nirvana first taste bliss short lived terrible side effects maltitol kicked discomfort unlike anything ever felt blew like balloon painful abdominal cramping symptoms passed unpleasant though hard believe low calorie sweetener could culprit symptoms gone stopped eating chocolate hunch something maltitol unfortunately confirmed year later purchased delicious sugar free popcorn local market taste amazing looking label wondering could possibly make yummy new sugarfree treat taste good heart sank followed little asterisk next sugarfree sweetener bottom label read maltitol tiny little letters thank goodness would eaten little still ended side effects much shorter duration people use maltitol heart content others like bad reaction case like maltitol","warning  warning   alcohol sugars "
"okay would go way buy","nothing special"
"tea flavor whole brunch artifial flavors returnable wasted 20 bucks","no tea flavor"
"looked like perfect snack trail mix unfortunately arrived solid mass melted chocolate left pantry days opened room temperature still gooey fridge breaking hunks ever since taste good chocolate grainy melting solidifying order online see store would pick","good"
"taste really good purchasing different brand similar taste texture agree reviewer regarding ordering summer insulating packaging ice packs melt warm weather like chocolate food items order cold weather buy enough last","taste great"
"taste great berries melted may order winter order cold weather enjoy flavor","order only in cold weather"
"know cannot make tea good granted south know never enjoyed tea sweet without sweet tastes crisp","this is the best"
"peppermint stick delicious fun eat dad got one christmas remembered similar one little girl 30 love","delicious "
"great gift ages purchased giant canes recipients loved much kept would eat","great"
"know product title says molecular gastronomy let scare looking food science something earth use make coffee creamer <br ><br >i coffee blonde sweet flavored creamers full bad kinds fat honestly hate use manufactured food items really think good body hand hate using cold milk cream like hot coffee <br ><br >i stumbled across amazon one day got idea making creamer also bought low fat non instant milk powder regular milk powder non instant lowfat milk little sweeter tastes fresher regular instant low fat milk dissolve good cold water problem hot coffee play ratios would heavy cream made coffee rich also think powder expensive use like mixing 1 3 together <br ><br >for flavoring bough cocoa bean powder vanilla bean powder caster superfine sugar mix small batches along spices like cinnamon nutmeg make flavored creamers wanted could use fake sweetner powder instead make small amounts store jelly canning jars also use little food chopper food processor blend everything sugar heavier sinks bottom let settle bit opening top though <br ><br >this stuff tastes way better storebought creamers fun experiment come flavors going try using essential oils next see get good chocolate orange mix <br ><br >all ingredients mentioned online take time experiment maybe use low fat milk add flavorings also would make great housewarming host ess gifts <br ><br >i sure molecular people able tell sure experiment cooking main reason bought make creamer worked great","forget molecular gastronomy   this stuff rockes a coffee creamer "
"dogs like flavors tried dog food reason itching increased tried lamb rice itchy dogs giving limited ingredient dog food try help duck sweet potato cut itching significantly tried lamb rice started itching like natural balance quality ingredients","natural balance lamb and rice"
"awesome dog food however given boston severe reactions food ingredients itching increased violent jumping bed night scratching soon changed different formula scratching stopped glad natural balance choices guess try find best pet","increased my dogs itching"
"three dogs love food bought specifically one dogs food allergies works great hot spots tummy problems <br >i love ships right door free shipping","great food "
"dog ton allergies environmental food prescription dog food tested see allergies got test back learned allergic something prescription brand finally found dog food done well still environmental triggers happy finally eat something know cause pain","great for my dogs allergies"
"shepherd collie mix ibs vet recommended limited ingredient food really helped symptoms likes always buy amazon 10 cheaper free shipping","great for stomach problems "
"natural balance dry dog food lamb meal brown rice recipe wonders jack russell awful food allergy food last hope last food could find something allergic problem eating dry normally mix natural balance dry lamb brown rice natural balance wet lamb brown rice seems like better started feeding dog bichon loves dog allergy stomach issue want dog eat better food see difference pet","better life for you dog "
"great food love idea one food ages breeds ît real convenience well really good product 3 dogs eat less almost gas poop regular perfect consistency else mom ask","great food"
"standard poodle pomeranian wonderful food switched different food due price couple times end going right back natural balance","great food for my my dog who has a sensitive stomach "
"great dog food dog severs allergies brand one feed","great dog food"
"food great ages dogs 3 year old puppy soft hardly ever get sick food good especially amazon prime shipping","mmmmm mmmmm good "
"golden retriever one picky dogs ever met experimenting various types food found loves natural balance really like natural balance fact multiple flavors dry wet varieties mix dry food little wet food golden loves furthermore like mixing flavors time think meal day day might get little boring figured tend stay away fish type though smells <br ><br >additionally started purchasing amazon petco wet food box couple cans came home surprise realized could save 20 time bought dog food buy amazon <br ><br >all definitely recommend give stamp approval natural balance dog food never eaten dog seems love","great dog food "
"food get pet store delivered door price slightly less","so convenient"
"pleased natural balance dog food dogs issues dog foods past someone recommend natural balance grain free since possible allergic grains since switching issues also helpful different kibble size larger smaller sized dogs","good healthy dog food"
"1 1 2 year old basenji jack russell mix loves dog food noticeably healthier energetic since switched standard dog foods earlier year despite higher cost natural dog foods find eats significantly less natural balance dog foods still stays happy full normal dog foods would eat 3 cups dog food day recommended serving size whereas eats 1 cup 1 1 2 cup natural balance dog food day take account actually getting bang buck natural dog foods since buy much last long normal dog foods healthier happier dog boot add fact get free 2 day shipping amazon prime sold","great dog food"
"pup experienced allergies forms hotspots itching dog foods cheap buy anywhere food crazy preservatives cause health problems pets food works wonders reducing allergies dog loves food <br >this message ramsey frankenstein approved","great allergy sensitive dog food  dogs love it"
"english bulldog skin allergies summer got age 3 vet recommended wean food previous owner gave iams lamb rice onto new kind second one tried working ever since dogs need limited diet sensitive additives proteins commonly found commercial dog food like chicken beef","perfect for our english bulldog with allergies"
"fed golden retriever hated would eat gave terrible diarrhea buying also super expensive","bad"
"mouth says love thee let count ways <br >if like apple products must item draw back shipping cost heavy","taste wise it is a 6 star item"
"arrived slightly thawed parents would accept however company helpful issued full refund","great support"
"crust tarts perfect husband loves crazy sour tart taste eat crust hubby takes filling kids think great maybe","tart "
"absolutely scrumptuous husband love however another customer put expensive ship cost shipping tartlets","omaha apple tartlets"
