"Story","Highlights"
"daughter infant allergic something breastmilk put neocate worked wonders allergic colitis son therefore careful came time picking formula supplement breastmilk stomach react accidentally dairy tolerate pediatrician recommended lactose free formula especially given asian background wanted something organic soy lactose free clean label possible formula fulfills criteria son like first switches easily breastmillk formula gassy spit really wish amazon stocked","we are a fan"
"love pasta love seem able digest pasta tastes great easy digest added bonus healthy low calories tried every version pasta amazing reviewers complained pasta firm case simply need cook bit longer regular pasta light feather wonderful tastes light would think eating homemade pasta almost hard beleive stuff comes box","absolutely awesome "
"eat pasta every day without guilt love pasta maintain desired weight without problem cook pasta little longer normal pasta every bit good","pasta lovers dream"
"box 8oz usually make 8oz mixed lean protein meal husband leftovers rare time however half leftover b c felt full could eat anymore wonder b c high amt fiber whatever morning hubby tells 3 lbs jealous also eating binge almost 2 weeks always feeling unsatiated last night strong urges eat snacks ate apple habit eat something b c truly hungry say outcome everyone thought would share using leftover pasta bean soup tonight would like eventually try different varieties shapes pasta","good "
"love stuff get amazon arrived time good condition enjoy","great calorie cutter"
"quick note good friend mine also battles weight issues love pasta turned product bought box whole foods impressed taste especially low calories high fiber content amazingly 40 cheaper amazon whole foods amazon prime customer saved shipping <br >i back soon love quality bargain","real pasta with half the calories and most of the taste "
"love pasta mix regular pasta meal half half love lower calories fiber content","great pasta"
"husband low carb diet two years miss pasta tried low carb pastas crazy loved fiber gourmet taste midway white whole wheat pasta unlike low carb pastas experience side effects terms digestive issues know mean cannot wait try products fiber gourmet","fabulous "
"love pasta cook little firm cooked bit longer pesto good husband could tell difference know good fussy","fibergourmet light penne"
"wow pasta tastes like real thing unlike brands labeled whole wheat pasta tried many times simply could get pasta eating experience eat half box time 4 ozs filling cannot eat wanted keeps satiated night even get urge snack like miracle even children absolute pickiest eaters world love pasta eat substitute real unhealthy alternative reviews absolutely correct cook 2 5 minutes longer would cook pasta even box says sure amazon like comment much cheaper fiber gourmet web site double amount price day writing review","italian born pasta lover gives this 5 stars "
"low carb diet lost 25 pounds tired eating meat time nervous splurge pasta came across product amazon cook minute two longer directions top full fat greek yogurt parm cheese one serving filling yummy definitely cures cravings subscribe save hubby son love","fantastic"
"know product good true half calories regular pasta wow","fabulous product"
"great product recommended dr oz love pasta calories much better whole wheat","pasta"
"brought box visit daughter family <br >we enjoyedjthe fiber gourmet light penne much","i thought it was exceptional"
"good tasting product raise blood sugar much regular pasta still cannot eat whole box expect glucose levels normal","fibergourmet light penne  8 ounce boxes  pack of 6 "
"first wonderful pods delivered door free charge auto delivery cheaper cheapest senseo pods found target walmart check weight coffee per senseo pod vs particular baronet coffee pod baronet pods weight however check products carefully guess better mention coffee flavor great one order three boxes pods","i will never go back to senseo pods as long as these are available "
"coffee absolutely horrendous cannot believe favorable reviews agree reviewer believes positive reviews written employees cannot stress enough bad coffee even taste like coffee best way describe cup chemicals really bummed cannot returned complete waste money went garbage","disgusting"
"pods much better senseo pods 10 grams pods packed coffee senseo pods making better stronger flavorful cup coffee use melitta one one also love pod individually packaged stay fresh come stand box dispenser nice cannot understand reviewer like coffee love decaf really best pod found also value cannot beat comes 3 boxes order order get 54 pods baronet many flavors check baronet flavors though baronet pods 10 grams pods come individually packaged stick 10 gram individually packaged pods disappointed get three different baronet coffee pod flavors auto delivery highly recommend yum","big pods  great value  delicious decaf coffee "
"flavor pods horrid ordered senseo stock long needed decaf pods received couple good reviews suspect written baronet employees never tasted awful coffee big yuk baronet","these are absolutely revolting"
"enjoying coffee vanilla little overpowering strength coffee good use one packet make 2 4 oz cups senseo coffee maker definitely saves money plus easy make coffee clean morning","nice strength  maybe too much vanilla "
"using","rich and flavorful "
"many different flavors choose ordered brand first time taste wonderful decaf french vanilla could find decided switch old brand one","great taste "
"far best pudding mix see store shelves everyone seems buy milk chocolate pudding guess like cook pudding stove best pudding cooked cooked instant pudding equal carl","great dessert"
"searching everywhere locally putting elated find amazon pudding mother made chocolate pies tradition continues thank much amazon","pudding"
"come sent instant choc fudge pudding <br >the order told send cook serve choc fudge pudding <br >you show picture <br >why could send <br >it makes wonder order anything else <br >pissed","cook   serve choc  fudge pudding"
"honey serious sweet tooth accommodate preparing weekly dessert martha white muffin mix convenient prepare requires one half cup milk toss cuisinart wah la six beautiful muffins virtually prep time moist delicious economic","quick  easy and delicious"
"followed easy instructions turned delicious ate 6 mixed 1 2 cup milk dry mix slowly mixed together poured mix sprayed cast iron 6 cup muffin pan cooked small convection oven cooked nicely moist inside mixes fresh smelling freshness date well 2013 pouch nice tough plastic one keep mix fresh easy open also","easy to make also"
"love love love muffins moist delicious like best day bake 2nd day dry bit wonderful pop toaster oven min warm good new complaint difficult find def worth every penny","best muffins in the world    "
"first time purhcasing muffin mix well baking muffins muffins came little dry tasted great people shared said good likely purchase marth white muffin mix future muffin mix came excellent price cannot complain <br >thank amazon com everything sun sale","martha white chocolate chocolate chip muffin mix"
"tried martha white turtle fudge chocolate chip cookie recipe worst cookies ever made either someone staff martha white lopsided sense humor taste buds taken permanent vacation wasted time lot money chocolate pecans effort martha white either needs tweek recipe take website unsuspecting housewife waste money time worthless cookies husband picked one way kitchen within two seconds came back threw garbage","worst cookies ever     "
"brought 2 bottles one carry pocket home fell love vacation belize couple drops trick packs ton flavor hot overpowers food","love it  "
"good product decent shipping however price 15 95 later found item local store 6 95 gouge","good but way too expensive"
"bad prepackaged quickie meal looking authentic thai give half flavor name taste thai quite accurate cartons fancy big amount hold definitely enough meal looking full takeout carton food eat better grab two tasty enough meal get authentic asian supermarket guarantee find much tastier options also quick easy make substance flavor much lower price ie 6 boxes noodles 6 talking cup noodles things find american supermarkets overall husband noodle mongers enjoy something new palate however probably opt order thai takeout fresh noodles next time craving","not bad  but it really is just a taste of thai"
"like eating large box paste enjoy flavor usually cook mix something else eating go straight box","good flavor but   "
"simply like easy prepare eat feel eatting lot artificial ingredients cannot even finish one fourth","artificial flavor"
"overall good great ginger sauce seemed like need extra something get fourth star think expecting little ginger taste would buy especially find good way punch little may try egg tip","needs a little something"
"taste thai coconut ginger noodles really yummy coconut ginger flavors mild <br ><br >each recloseable chinese takeout shaped box conveniently serves microwaveable container one box makes enough 2 filling lunches whole family share side dish kids always lunge opportunity <br ><br >the negative thing say wish many separate little seasoning packets mix 3 plus noodles single combined spice packet would easier course one benefit multiple packets ability leave certain spice fond like","really good "
"enjoy taste tai peanut noodles rock peanutty flavor mmm decided try um ginger much nothing really distinguishes noodle flavor ginger bit overpowering <br ><br >take review stride though ginger lover talking gilligan island may right alley bit outside though may mix metaphors","not so much   "
"provided use clean preferably purified water cook great tasting hold main meal far superior instant noodle packages part gluten meat free except shrimp flavor <br ><br >while people remarked sized packaging actually allows good thorough mixing flavor packets noodles little chance spillage <br ><br >while coconut ginger variety tastes good may bit subtle looking actual taste thai would recommend thai peanut noodles seeking something bit pronounced thai flavor highly recommend taste thai peanut salad dressing added salads meats peanut noodles spicy thai experience <br ><br >overall taste quantity subscribe save offer provides best deal comparatively speaking terms price wal mart offers noodles cents cheaper compared subscription price seem carry coconut ginger variety least store near <br ><br >if tried brand instant noodles yet think treat","more than just a taste of thai"
"really like soup mild like anything hot right good flavor something take work pop microwave would buy","taste of thai coconut ginger soup"
"quick easy portable think tastes great favorite flavor","delicious "
"bought walmart less 2 00 dollars box 2 80 box amazon box six need add another 7 00 dollars order get free shipping would buy could better added chicken egg like reviewers mentioned box say gluten free maybe 2 versions","okay in a pinch   "
"year ago use buy quite often gluten free last month decided order product longer says gluten free packaging contains wheat want go waste ate one anyway became sick enjoy product purchasing wheat warning also issues wheat gluten","now containing gluten "
"thanks egg tip works well really helps product nevertheless ended giving away three six containers thrilled nutritional information","not bad  but i will not reorder"
"tasty easy make need quick filling meal needs gluten free works great try thai peanut one","great gluten free quick fix meal"
"ordered pack ate quickly husband like taking work lunch recipe get protein slip fresh unbroken egg box leave home morning add egg water cook lunchtime","easy and delicious"
"tasty gluten free option kids loved spicy","gluten free goodness"
"thai coconut ginger noodles quick easy prepare rewarded delicious noodles enjoy share side dish another noodle enjoyer","tasty and easy"
"liked much ordered keep<br ><br >re ordering","quick  yummy  unusual soup"
"recently tried similar product trader joe tj around presently decided try readily available variation really like thing much starters much packaging liking many things throw away agree previous reviewer kind big cartons much hold inside container 4 packages one noodles three various seasonings add water give fill line kind awkward microwave 3 minutes stir microwave one minute one trader joe two packets one noodles one sauce water involved microwave 2 minutes done lot tastier like texture thing everything clumped together much really much taste especially considering three different packets seasoning put time try couple brands things","eh   "
"bought son take work lunch apparently co workers found smell offensive asked eat work maybe bad batch","horrible smell"
"plan reordering definitely edible filling since added chicken","for  2 00 a box it is okay"
"tried love thai food ginger coconut problem mess even vaguely resemble thai food discernible ginger coconut taste plus noodles stick together even prepared suggested come big clump try eat <br ><br >also nutrition label misleading dieting read labels carefully says serving one cup also says one package weighs 4oz half cup figured say otherwise type meal usually one serving adding water would one serving per package one package actually two servings 500 calories far pre packaged noodle meal seen <br ><br >the excessive calorie content might ok product tasted good would definitely recommend stay away mess","tasteless mess"
"great delicious way eat thia food home melt entire packet like spicy two cans coconut milk pan add favorite meat veggies usually use chicken strips bag frozen asian veggies","yum "
"restaurants always best curry pastes pretty tasty easy use fast add meat veggies choice scared something spicy might use little less right like spicier add little crushed red pepper since coconut milk added separately also control fat content go light go much yummier creamy stuff find green curry little sweeter red panang curries maybe little less spicy","tasty and so easy"
"much hotter normal green curry one pack makes many servings","hot hot hot"
"used use another brand changed jar much better pleasing hot spicy taste hint lemon lime good amount heat little salty though like use fair amount spice wish lower sodium content made scratch fresh ingredients always better next best thing really good chicken beef pork tofu veggie dishes quick easy make good meals like packaging wish jar sodium content like buy","very good thai green curry   "
"second order good hot like best sample per preferences","curry paste"
"really impressed many flavors quite bit heat favorite brand cocunut milk make great thai curries home","tons of flavor  very spicy  excellent "
"different flavors different people everyone going like others like love coffee <br ><br >it totally subjective <br ><br >i give 5 stars enjoy coffee lot price reasonable opinion matches local big box grocery store","house blend is good coffee"
"5 star hotel served tea meeting fantastic asked server could get name company unable thank goodness amazon able find best many years arrived time securely packed","my order"
"totally love tea brews beautiful reddish color aromatic beautiful look could potpourri love sachets comes elegant bought third canister morning everyone office friends loving best honey pearls also sold white lion tea organic","delicious "
"stuff rocks two different spas love tart really unusual real treat","soooooo good   "
"husband new favorite tea huge hibiscus taste good sure buying","new favorite"
"nice tea steep 3 times strong cranberry flavor probably would good cold tea recommend love cranberry","nice tea   very strong cranberry flavor"
"found tea 5 years ago staying spa resort washington <br ><br >i absolutely love herbal helps relax flavorful taste color great colds well clearing sinus soothing beautiful delicious <br ><br >i ordered tea every year amazon com price amazing well worth likewise given others gift afford <br ><br >this tea wonderful honey sugar sweetener must purchase every household also great road tea drinkers","best tea ever"
"love love love 10 year old drink herbal tea quite often tasty","delicious "
"good tea elegant sachet little pricier produces wonderful flavor whether drinking hot cold","delicious cup o  tea"
"found product sale vacation north carolina loved great maple flavor walmart sold 3 99 24oz pack wish would bought paying 15 walmart sell 4 robbery disappointed zon insanely high price price reasonable would love buy rate much higher","product is great price is insane"
"high hopes ordered tea years ago san francisco used buy lovely rose black chinatown favorite tea ever unfortunately blend lacks body high caffeine prefer opposite full bodied tea brew strong without sending blood pressure roof someone wants light tasting tea powerful caffeine punch might good choice","jittery  lacks body"
"doggie really likes newman organic better dog foods pet big box stores sell budget like newman organic much harmony farms compromise keeps doggie budget happy eats heartily worry getting enough high quality food otherwise eat food graze trash seeking egg shells bones fill void <br ><br >there barfing digestion problems accidents high quality food means good digestion shiny coat high energy bright eyes good attitude without tons additional elixers treats vet bills definite cost effective win win doggie <br ><br >i great results newman dog food orderd amazon 5 pounds less price <br ><br >psst organic fanatic nutritional value counts fur baby human kids <br ><br >update 3 26 2011 noticed jumped almost thirty bucks opt newman organic costs per pound dog likes harmony newman budget likes one cost effective time purchase <br ><br >update 5 17 2012 last batch harmony farms ordered rancid oil smell opened bag pooch would eat readily past would eat day started checking trash subsequently purchased canned pouch foods cooked brown rice etc mix ins encourage make pricey bag sure stored arrives home texas heat make anything stale rancid yucky quickly probably called customer service felt replacement would issue due hot weather definitely exploring hot weather alternatives","high quality my dog enjoys and my budget does too "
"years back prompted death one dogs due inoperable brain tumor switched dogs foods without corn convinced right wrong animal died needlessly usage steriods prescribed cure constant ear infections believe right wrong recurring ear infections caused allergy corn turned main ingredient food sorry get soapbox address issue hand found food accident type store weight loss formula turns dogs love seen spunky full energy got coon hound two jack russells mine bounce wall kind mine mellow laid back kinda dudes gobble stuff seem stay full begging kitchen normal everyone skin seems smoother eyes brighter heck think go bowl say looking good quality dog food one disappointed","this is great dog food "
"2 year old portuguese water dog always seemed sensitive stomach 15 year old shepherd x dog beginning lose weight slept almost time getting fussy would eat believe dogs sense smell know exactly food however choice eat feed google commercial dog foods see dog may thrilled eat dog detect cancer person detect sorts things supposed eaten anyway used feed purina lamb rice dogs finding young porty trouble 15 yr old would eat bits leave dish started making food came wonderfully nutritious tasty recipe dogs loved homemade dog food 15 yr old began putting weight always time make food homemade dog food kind hard wallet started research natural dog foods compare costs etc arrived harmony farms guess dogs love much love home made dog food young porty longer stomach troubles looks great 15 yr old finishes meals looks shiny coats energy one believe old girl 15 years old told friends harmony farms dog food switched reported similar positive results brother law dog always fussy eater skin problems thinning coat started feed harmony farms became eager eater happy outgoing skin coat condition completely cleared thinking allergy whatever food think iams friends commented happy dogs meal time feeding dogs premium top line dogs foods paying top line prices harmony farms products reasonably priced cheapest dog food shelf opinion buying best quality food market incredibly good deal may also mean make fewer trips veterinarian office friends happy found food dogs","i would give harmony farms extra stars if i could "
"co worker animal rescue brought whole dog journal recently astounded feature article month covered dog foods feeding dog beneful basically junk food switched immediately hunted around amazon find natural food fit bill shipping free awesome dog loves food worried b c switched uninterested top gravy etc <br ><br >do research blow mind pets eating regular grocery store dog food typically high ratio corn filler want pet live long healthy life ingesting high list glad knowledge really wish would looked two dogs years years ago","awesome "
"heavy grocery bags ordered first bag harmony farms dog food delivered door ups food excellent quality bought product based healthy ingredients dogs love love amazon making easy buy <br ><br >july 2010 one dogs bouts inflammatory bowel disease previously special food vet royal canaan duck potato past 4 years tolerated even thrived harmony farms food w problems bag harmony farms 20 cheaper royal canaan hard fight believer <br ><br >the canned food great <br ><br >september 2011 dog inflammatory bowel disease past verified surgery never felt better wire energy 2 yr old dog 7 daily medication healthy weight formula helped thrive enough protein much fat seem trick highly recommend","quality dog food delivered to your door "
"giving shihtzu fromm adult gold dog food seem want eat though thought would try something different found harmony farms thought would give try actually liked cheaper food seemed contain really healthy ingredients could believe gobbled week developed rash stomach took rash went away completely 2 days hair also soft kibble well","did not do well for my dog"
"using castor pollux amazon dog decided try something different dog dug dog food right away helped maintain rough coat softer smoother food really helps keep weight healthy level <br ><br >i catch cat sneaking dog food bowl eating food look getting harmony farms harmony farms really good quality food affordable","the cat likes it  too "
"ordered came today thought would try well amazement little daisy ate wanted little dog 8 yrs trouble flare ups pancreas avoid fats corn needs fiber making dog food missed eating dry wondered small enough chew","my fussy min  dachshund loves the taste "
"feeding 3 hounds purina one liked thought would try since much liked ingredients love plan order future","my dogs love it   "
"everyone know healthier dog food walmart brands like purina iams god forbid moist meaty ingredients like ground flax seed peas whole carrots whole sweet potatoes apples blueberries probiotics lack sweeteners products low quality corn show true <br ><br >i taste test harmonic farms dogs old iams proactive health decided make results known let smell thoroughly without letting eat first placed two piles bit apart immediately went harmonic farms finished even look iams coming back wagging tail hoping <br ><br >dogadvisor com made aware past mistakes dog food choices hoping god would shy away healthy organic stuff like great welcome surprise guess hippie heart hand take nachos bell grande","passed the taste test "
"ten year old doxie annie never right never would eat dry food harmony farms healthy holistic chicken brown rice adult dog food bought every day shock finishes every nugget dry dog food amazon truly amazing grateful bought 17 5 pound bag harmony farms dog food ordering soon head towards end current bag wow happy","our ten year old doxie"
"harmony farms produces excellent dog food products 8 month soft coated wheaten terrier sensitive gluten corn meal products generally found popular brands preparing take vet 4 months old b c great difficulty eliminating point whining would attempt go research breed purchased harmony farms local store expensive quickly resolved puppy digestive issues 5 8 days harmony farms products puppy happy healthy <br ><br >i happy find harmony farms amazon economical delivered right door puppy connor eats harmony farms dog food treats much happier puppy definitely recommend soft coated wheaten terriers breeds difficulty digesting popular brands","excellent for wheaten terrier s sensitive tummies "
"wish would known long time ago difference dog food makes 6 year old jack russell always worst shedding problem recently read excessive sign poor nutrition feeding p urina dog chow dog food two weeks noticeably tell difference shedding loves taste love price good quality dog food","my dog now sheds less "
"purchased harmony farms healthy weight formula mini dachshund jack russel terrier love added shih tzu pack loves also would highly recommend others kibble right size small dogs","my dogs love it"
"main ingredients dog food much better ingredients common grocery store brands tends less expensive specialty brands dog coat looks shiny seems much healthier since switched food year ago nice thing target sells brand ever find end bag ordered time stop target","very good"
"pleased dog food sheltie good coat good movements harmony farms much better food others picky eater add chicken eat stick harmony farms also like bag helps keep food fresh","good dog food"
"dog loves food maintained healthy weight many years vet happy general health coat teeth 16lb bag sent directly home without shipping charges terrific 16 lb size available area","hard to find locally"
